{
    "id": 11,
    "items": [
        {
            "name": "poke-doll",
            "url": "http://localhost/api/v2/item/63/"
        },
        {
            "name": "fluffy-tail",
            "url": "http://localhost/api/v2/item/64/"
        },
        {
            "name": "black-flute",
            "url": "http://localhost/api/v2/item/68/"
        },
        {
            "name": "white-flute",
            "url": "http://localhost/api/v2/item/69/"
        },
        {
            "name": "super-repel",
            "url": "http://localhost/api/v2/item/76/"
        },
        {
            "name": "max-repel",
            "url": "http://localhost/api/v2/item/77/"
        },
        {
            "name": "escape-rope",
            "url": "http://localhost/api/v2/item/78/"
        },
        {
            "name": "repel",
            "url": "http://localhost/api/v2/item/79/"
        },
        {
            "name": "poke-toy",
            "url": "http://localhost/api/v2/item/618/"
        }
    ],
    "name": "spelunking",
    "names": [
        {
            "language": {
                "name": "en",
                "url": "http://localhost/api/v2/language/9/"
            },
            "name": "Spelunking"
        }
    ],
    "pocket": {
        "name": "misc",
        "url": "http://localhost/api/v2/item-pocket/1/"
    }
}
